idorganization,passwordhash,name,abbreviation,juridicalentity_idjuridicalentity,street,streetnumber,postal,city,province_idprovince,telnr,faxnr,url,organizationtypeother,goal,organizationkeywordother,remark,active,datecreated,email
373,,Samenhuizen,,1,Toekomststraat,6,1800,Vilvoorde,2,,,www.samenhuizen.be,,Bevorderen en ondersteunen van alle vormen van gemeenschappelijk wonen in het bijzonder en bijdragen aan een grotere verscheidenheid aan woonopties in het algemeen.,NULL,NULL,1,5/21/2012 12:38,
374,,wthoilvt,1,4,1,1,94102,San Francisco,1,,,1,1,1,NULL,,0,5/27/2012 22:54,
359,,Bouworde vzw,,1,JP Minckelersstraat,78,3000,Leuven,2,,,www.bouworde.be,,"Bouworde vzw is een landelijke jeugdvereniging die jongeren wil vormen en bewust maken van de kansarmoedeproblematiek. Dit doen we door hen als vrijwilliger te laten werken op projecten in Afrika, Azië, Europa of Latijns-Amerika. Projecten zijn technisch, sociaal of ecologisch. ",NULL,NULL,1,2/22/2012 16:02,
360,,çavaria,,1,kammerstraat,22,9000,Gent,4,,,www.cavaria.be,,"Çavaria inspireert, stimuleert en ondersteunt verenigingen en individuen die opkomen voor een brede kijk op seksuele oriëntatie, genderexpressie en genderidentiteit. Ze streeft het welzijn na en komt op voor de rechten van homo's, lesbiennes, bi's en transgenders in alle aspecten van het dagelijkse leven.",NULL,NULL,1,2/24/2012 12:05,
361,,Schone Kleren Campagne,SKC,4,Haachtsesteenweg,579,1031,Brussel,2,,,www.schonekleren.be,,De Schone Kleren Campagne voert actie voor betere arbeidsomstandigheden in de kledingindustrie wereldwijd,NULL,NULL,1,2/29/2012 16:03,
362,,Natuurpunt Studie,,1,Coxiestraat,11,2800,Mechelen,1,,,www.natuurpunt.be/studie,,natuurbehoud en soortenbescherming,NULL,NULL,1,3/1/2012 15:17,
363,,Groep intro Vzw regio Brussel,,1,C. Parentestraat,6,1070,Anderlecht,6,,,Www.groepintro.be,,Vorming en opleiding voor kansengroepen,NULL,NULL,1,3/1/2012 22:18,
364,,Willemsfonds vzw,WF,1,Vrijdagmarkt,24,9000,Gent,4,,,www.willemsfonds.be,sociaal-culturele verenging,"Het Willemsfonds vzw is een Vlaamse, liberaal-vrijzinnige, culturele vereniging die in Vlaanderen en in het Brussels Hoofdstedelijk Gewest via al haar geledingen (afdelingen en Provinciale Verbonden) aan sociaal-cultureel volwassenenwerk doet. De vereniging heeft daarbij aandacht voor samenwerkings- en uitwisselingsprojecten met organisaties in binnen- en buitenland.



Met haar sociaal-cultureel volwassenenwerk verdedigt de vereniging de Nederlandse taal en cultuur. Zij streeft de culturele, economische, wetenschappelijke en maatschappelijke ontwikkeling na, alsook de emancipatie van het individu in een klimaat van verdraagzaamheid en van geestelijke en politieke vrijheid.



Het Willemsfonds vzw biedt een discussieplatform aan door informeel en interactief te leren in groepsverband. Op die manier worden vooroordelen afgebouwd, en een positief leefklimaat tot stand gebracht, wars van elk eng nationalisme, racisme, xenofobie, ideologisch, religieus of partijpolitiek fanatisme.",NULL,NULL,1,3/19/2012 10:45,
365,,Boeren op een Kruispunt,,1,Brouwerijstraat,1,9880,Aalter,4,,,www.boerenopeenkruispunt.be,Hulporganisatie voor land- en tuinbouwers in moeilijkheden,Ondersteuning geven aan land- en tuinbouwers in nood en heeft als missie hun welzijn te verhogen en nieuwe kansen te creëren,NULL,NULL,1,3/23/2012 16:37,
366,,Mobiel 21,,1,Vital Decosterstraat,67A,3000,Leuven,2,,,www.mobiel21.be,Socio-culturele beweging,"Mobiel 21 is een beweging voor duurzame mobiliteit. Mobiel 21 kiest ervoor de leefomgeving op een meer milieuvriendelijke en veiligere manier bereikbaar en leefbaar te maken. Mobiel 21 inspireert en activeert mensen, groepen, organisaties en beleid om doordacht om te gaan met verplaatsingen en verplaatsingswijzen.",NULL,NULL,1,4/2/2012 12:14,
367,,Thuiszorgwinkel,TZW,3,Beverensestraat,68B,8850,Ardooie,5,,,www.thuiszorgwinkel.be,,Aanbieden van hulpmiddelen + info en advies,NULL,NULL,1,4/3/2012 14:57,
368,,Privé,,4,ijzermolenstraat,3,3001,heverlee,2,,,,,/,NULL,NULL,1,4/17/2012 19:03,
369,,Wetenschapswinkel UT,Wewi UT,4,Postbus,217,7500 AE,Enschede,3,,,,,Brug samenleving en onderzoek,NULL,NULL,1,4/26/2012 13:59,
370,,Elcker-Ik Centrum,,1,Breughelstraat,31-33,2018,Antwerpen,1,,,www.elcker-ik.be,,"Elcker-ik Centrum is een actief en veelzijdig forum, waaraan vorm gegeven wordt door vele mensen, vooral vrijwilligers. Hierna volgt een overzicht van alle activiteiten die wij aanbieden. Doorheen al deze activiteiten willen wij een uitnodigende gelegenheid tot ontmoeting aanbieden. Ontmoeting tussen nieuwe en oude Antwerpenaren, tussen actievelingen en gepensioneerden, tussen leergierigen en wie kennis te delen heeft.



Dit is wat wij aanbieden: 

- lezingen en cursussen

- het Elcker-ik café: ontmoeting en gespreksgroepen 

- Nederlands voor vreemdelingen

- Samenwerking met andere organisaties

- Een buurtfoyer



Lezingen en cursussen



Elcker-ik Centrum richt jaarlijks zo’n 315 lezingen en cursussen in. De thema’s die hierin behandeld worden gaan van actualiteit en geschiedenis, wetenschap, religies en filosofie over cultuur en levenskunst tot talen, pc-toepassingen, en creatieve ateliers. Het volledige overzicht vindt u onder ZOEK EEN CURSUS. 

Let wel, in onze cursussen wordt geen gortdroge stof onderwezen! Professoren, auteurs en deskundigen komen in verstaanbare taal en vaak op gepassioneerde wijze spreken over hun vakgebied. Na een lezing van 2 uur ben je vaak beter geïnformeerd over een onderwerp dan na het doorworstelen van een moeilijk boek. En dit steeds voor een democratisch prijsje. Het doel dat Elcker-ik nastreeft is immers om eigentijdse kennisinhouden toegankelijk te maken voor iedereen die daarin geïnteresseerd is. 

Bovendien is er na de lezing steeds gelegenheid tot nabeschouwingen en discussie. Soms blijft de spreker ook nog een glas drinken na de lezing. De debatcultuur is springlevend in Elcker-ik! Maar ook het respect voor ieders mening en de openheid naar diversiteit toe. Wie de lezingen bekijkt, merkt al snel dat ze heel gevarieerd zijn, zowel qua inhoud als qua opstelling. Soms wordt eenzelfde thema behandeld vanuit verschillende perspectieven: religieus en vrijzinnig, wetenschappelijk en spiritueel, christelijk, islamitisch, joods en boeddhistisch, theoretisch en praktisch, je vindt het allemaal terug in onze programmatie.



Ontmoeting en gespreksgroepen



Het café van Elcker-ik is meer dan zomaar een café. Je kan er natuurlijk gewoon terecht voor een lekker kopje koffie aan een zacht prijsje. Maar heel wat mensen ontmoeten er elkaar ook rond een bepaald thema of komen voor een bepaalde activiteit. Al deze activiteiten zijn gratis! De juiste data vindt u onder ZOEK EEN CURSUS . Hier volgt overzicht van wat er allemaal te doen is:

- In het koffiehuis is iedereen welkom om van gedachten te wisselen over een bepaald thema. Er zijn twee regels: kom open en beschaafd op voor je mening; en luister aandachtig naar een afwijkende mening. Het Koffiehuis is open op de eerste en de derde donderdagvoormiddag, van de maand. De sfeer is ontspannen, er wordt vaak een stukje afgelachen!

- Het filosofisch café staat open voor mensen die graag filosoferen òf dat willen leren. Er is deskundige begeleiding van een filosoof. Geen saaie opsomming van leerstof, wel in een informele sfeer leren van elkaar. Bijeenkomst de laatste vrijdag van de maand.

- In het schaakcafé zijn beginnende en ervaren schakers welkom voor een partijtje schaak. Geen competitie, wel spelen voor het plezier. Elke woensdagavond.

- Het luistersalon voor vrouwen verwelkomt alle vrouwen die willen spreken en luisteren naar elkaar. Je hoeft echt geen mannenhaatster te zijn in deze groep! Maar een gesprek met vrouwen alleen heeft zo zijn eigen kwaliteit.

- Elke maand stelt de organisatie Fotocircuit Vlaanderen nieuw werk van een fotograaf ten toon dat te bezichtigen blijft aan de muren van het Elcker-ik café. Tien fototentoonstellingen verhuizen zo maandelijks naar een andere plaats. 

- E-I Single 60 + richt zich tot alleenstaande 60-plussers. Geen commercieel initiatief, geen huwelijksbureau, maar een bijeenkomst in de geest van Elcker-ik waar ontmoeting centraal staat. 



Nederlands voor vreemdelingen



Elcker-ik biedt een aantal gelegenheden aan om Nederlands te leren voor iedereen die dat wil. Taalonthaal: iedereen leert hier op eigen tempo en in de tijd die men beschikbaar heeft. 

Taallabo: hier leren beginners en gevorderden Nederlands lezen en schrijven.

Dialoogklassen: conversaties in groep, op verschillende niveaus.

Het Bab(b)elcafé: hier ontmoeten oude en nieuwe Antwerpenaren elkaar in het Elcker-ik café en spreken er over interessante onderwerpen.

Al deze activiteiten worden begeleid door vrijwillige lesgevers. Zin om mee te doen? Neem gerust contact op! Meer info en aanvangstijden: TAALONTHAAL



Andere organisaties die onder het dak van Elcker-ik gehuisvest zijn:



Samenleven.be is de vzw die zich bezighoudt met de organisatie van taallessen in Elcker-ik (zie hierboven). 

Vaka - Hand in Hand organiseerde in de jaren ’80 de grote anti-rakettenbetogingen, en vanaf begin de jaren ’90 (“Zwarte Zondag”) de massabetogingen tegen het opkomend racisme en voor  vrede en verdraagzaamheid. Vandaag informeert Vaka Hand in Hand  via mentaliteitscampagnes de publieke opinie en het beleid over de situatie van de nieuwe asielzoekers.

Het Platform van Afrikaanse Gemeenschappen (PAGA). Deze organisatie overkoepelt 66 actieve lokale verenigingen van immigranten afkomstig uit zwart Afrika, ten zuiden van de Sahel. Er verblijven  in Vlaanderen en Brussel ongeveer tienduizend personen uit die regio. PAGA stimuleert sociale integratie, emancipatie en deelname aan de economische, politieke en sociaal-culturele structuren.

Open School is één van de 29 Vlaamse centra voor basiseducatie,  en organiseert opleidingen voor laaggeschoolden: Nederlands, Wiskunde, Maatschappijoriëntatie… Hierdoor kunnen vele cursisten een stuk autonomer en weerbaarder in de maatschappij functioneren. 

Groep Intro biedt in samenwerking met de VDAB opleidingen en werkervaringsprojecten voor langdurig werklozen aan.



Buurtfoyer



Sinds 2005 is het gebouw in de Breughelstraat officieel erkend als buurtfoyer. De wijkvereniging Klein Antwerpen houdt er maandelijks zijn vergadering, waar alle buurtbewoners welkom zijn. De wijkvereniging is in de weer om de samenhorigheid te verstevigen en het leven in de buurt aangenaam te maken en te houden. Van de bekendste ereburger van Klein Antwerpen, Wannes Van de Velde, prijkt trouwens een buste aan de voorgevel van Elcker-ik Centrum. Meer informatie over de activiteiten van de wijkvereniging vindt u hier : www.kleinantwerpen.be .

",NULL,NULL,1,5/2/2012 14:51,
371,,PEFC Belgium vzw,PEFC,1,Centrumgalerij blok 2,6e verdiep,1000,Brussel,6,,,www.pefc.be,,"Promotie van het PEFC-label, een label voor duurzaam bosbeheer. Het label komt voor op papier of hout of afgeleide producten.",NULL,NULL,1,5/3/2012 11:54,
372,,vzw Recht-Op,,1,Lange Lobroekstraat,34,2060,Antwerpen,1,,,www.recht-op.be,,Armoedebestrijding met jongeren in armoede. ,NULL,NULL,1,5/14/2012 13:02,
375,,Unie van Belgische Adverteerders,UBA,1,Antwerpselaan,2,1853,Strombeek-Bever,2,,,www.ubabelgium.be,,"De UBA helpt adverteerders het rendement van hun communicatie-investeringen te maximaliseren door de effectiviteit, de efficiëntie en de duurzaamheid van communicatie te stimuleren in een open en transparante communicatie-omgeving.",NULL,NULL,1,5/31/2012 10:25,
376,,Palestina Solidariteit,,1,Vierwindenstraat,60,1080,Brussel,6,,,www.palestinasolidariteit.be,,"In eerste instantie wil Palestina Solidariteit tegemoet komen aan de nood aan degelijke informatie en zal ze de bevolking sensibiliseren over de achtergrond en evolutie van het Israëlisch/Palestijns conflict. Die bewustmaking is nodig om druk te kunnen uitoefenen op het beleid.



Palestina Solidariteit zal ook het actiecentrum zijn dat in ons land het voortouw neemt in de internationale BDS-campagne (Boycot, Sancties en Desinvesteringen). Het gaat om een sterk groeiende beweging die langs geweldloze weg strijdt voor de Palestijnse rechten en het beëindigen van de Israëlische bezettings- en kolonisatiepolitiek.



Andere activiteiten van Palestina Solidariteit zijn: het verspreiden van nieuwsbrieven, informatie- en studiedagen, opstellen en verspreiden van lespakketten, het kritisch opvolgen van de mediaberichtgeving (mediawatch), het organiseren van inleefreizen, enz. 



Palestina Solidariteit zal verder de ondersteuning op zich nemen van enkele projecten in de bezette Palestijnse gebieden. De zuidwerking biedt de mogelijkheid aan de sympathisanten en vrijwilligers om rechtstreeks steun te verlenen aan de Palestijnen in de door Israël bezette gebieden.",NULL,NULL,1,6/1/2012 11:25,
377,,RECHT-UIT,,1,De Leescorfstraat,2-Feb,2140,Antwerpen,1,,,www.recht-uit.be,,"VZW RECHT-UIT is een ‘eerste lijn’ hulporganisatie die zich richt naar alle hulpbehoevenden en/of zij die met levensvragen zitten, van jong tot oud.  Door beroep te doen op ‘ervaringsdeskundigheid’ bieden we vooral een integrale aanpak. Wacht niet tot het te laat is, we kunnen ons veel ellende besparen door vandaag nog met elkaar te praten. Theorie en kennis beschouwen we als informatieve ankerpunten, we bieden hulp op verschillende domeinen en werken vooral preventiegericht, we willen hiermee anticiperen op toekomstige problemen en dat in de ruimste zin van het woord. Ervaringsdeskundigen zijn de levende voorbeelden dat verandering in denken en handelen mogelijk is, mens en ontwikkeling staan steeds centraal. Ervaringsdeskundigen hebben de ‘zwarte periode’ in hun leven doorleefd en weten wat dat betekent, ze kunnen anderen hierin bijstaan. VZW RECHT-UIT gaat graag nog een stapje verder en deelt haar creativiteit met andere organisaties die het maatschappelijk welzijn bevorderen, dit zowel individueel als collectief. ‘Brainstormen’ stellen we centraal, we doen dit net iets anders dan ‘traditioneel’.



",NULL,NULL,1,6/10/2012 12:32,
378,,Erfgoedcel Haspengouw,,1,Abdijsite Diesterstraat,1 bus 3,3800,Sint-Truiden,3,,,www.erfgoedcelhaspengouw.be,,"Haspengouw ademt cultureel erfgoed: landbouw en fruitteelt, kastelen en

kerken, volkscultuur en dialecten... Erfgoed Haspengouw wil als projectvereniging van 10 gemeentebesturen in Zuid-Limburg dit cultureel erfgoed in kaart brengen, helpen bewaren en toegankelijk maken voor een groot publiek door samen te werken met de erfgoedzorgers in de streek (hemen, geschiedkundige kringen, scholen, culturele verenigingen, musea en archieven, vlijtige vrijwilligers...) ",NULL,NULL,1,6/14/2012 09:47,
379,,Jeugdraad Landen,,4,Wezerenstraat,5,3400,Landen,2,,,,,www.jeugdraadlanden.be,NULL,NULL,1,6/18/2012 16:20,
380,,Coördinatiecentrum praktijkgericht onderzoek en voorlichting voor de biologische teelt,CCBT,1,Karreweg,6,9770,Kruishoutem,4,,,www.ccbt.be,,"Het CCBT vzw heet voluit ‘Coördinatiecentrum praktijkgericht onderzoek en voorlichting voor de biologische teelt’ en werd opgericht in het kader van het Strategisch Plan Biologische Landbouw van de Vlaamse Overheid.



CCBT gaat voor innovatief, vraaggedreven en praktijkgericht onderzoek en voorlichting.



Het CCBT bezit een beperkt budget voor onderzoeksprojecten, maar voert zelf geen onderzoek uit. Dit gebeurt door de aangesloten proefcentra: Inagro, PCG, PPK, Pcfruit en Proefbedrijf Pluimveehouderij. De projecten zijn gedragen door de sector en zorgen voor praktisch toepasbare resultaten. 



Binnen CCBT wordt veel belang gehecht aan het verspreiden van praktijkinformatie op maat van de landbouwer. Via de website, de nieuwsbrief en voorlichtingsacties worden proefresultaten van Vlaams praktijkonderzoek bekendgemaakt.



Samen met NOBL, de proefcentra, de sectorverenigingen en de biobedrijfsnetwerken wordt zo het biokennisnetwerk Vlaanderen verder uitgebreid.",NULL,NULL,1,6/18/2012 16:28,
381,,Vlaamse actieve senioren vzw,,1,Lange Winkelhaakstraat,38,2060,Antwerpen,1,,,www.vlaamseactievesenioren.be,,Sociaal-cultureel volksontwikkelingswerk met ouderen in verenigingsverband;,NULL,NULL,1,6/19/2012 13:21,
382,,Jeugdtehuis,,1,Dirk Boutsstraat,10,3680,Maaseik,3,,,,Bijzondere Jeugdzorg,Bijzondere Jeugdzorg,NULL,NULL,1,7/3/2012 23:39,
383,,GC Nekkersdal,,1,E. Bockstaellaan,107,1020,Laken,6,,,http://www.nekkersdal.be,,"In haar doelstellingen stelt de vzw Gemeenschapscentrum Nekkersdal zich tot doel 'de identiteit van de Vlaamse gemeenschap en de kwaliteit van de Nederlandse cultuur te bevorderen en te versterken'.



Hiervoor bouwt de vzw een programma uit dat minimaal gestoeld is op vier basisfuncties:



    onthaal van, informatie en dienstverlening aan burgers en verenigingen;

    culturele spreiding, productie en uitstraling;

    educatie en permanente vorming;

    studie, advies, overleg, belangenbehartiging en actie.



Dit alles gebeurt vanuit een tolerante en verdraagzame visie op de multiculturele samenleving.



Gemeenschapscentrum Nekkersdal wordt bestuurd door een Raad van Bestuur en een Algemene Vergadering (de Gemeenschapsraad). Deze Raad van Bestuur en Algemene Vergadering worden aangeduid/verkozen door de leden van de Gemeenschapsraad. De Raad van Bestuur wordt voorgezeten door dhr. Julien Meganck. In de Algemene Vergadering zetelen twee afgevaardigden van elke aangesloten vereniging. Deze Gemeenschapsraad wordt voorgezeten door dhr Danny Bex.",NULL,NULL,1,7/4/2012 09:27,
384,,Netwerk Bewust Verbruiken,NBV,1,Edinburgstraat,26,1050,Brussel,6,,,www.bewustverbruiken.be,,"Het Netwerk Bewust Verbruiken vzw (NBV vzw) is een netwerkorganisatie die duurzame consumptie in Vlaanderen en Nederlandstalig Brussel bevordert. Onze strategie richt zich op het informeren en activeren van consumenten. Over verschillende consumptiedomeinen heen plaatst NBV twee kernthema's centraal: consuminderen en consumanderen. Samen met lidorganisaties en partners activeert NBV consumenten via gemeenschapsvorming, informatieverstrekking, educatie & sensibilisering.",NULL,NULL,1,7/24/2012 15:34,
385,,Europees Instituut voor het Belang van het Kind,,4,Ter Voortlaan,58,2650,Edegem,1,,,,,"De levensomstandigheden en ontplooiing verbeteren van kinderen die niet bij hun beide ouders opgroeien wegens scheiding of uithuisplaatsing. In samenwerking met plaatselijke en landelijke Europese particulieren en instellingen via internationaal empirisch wetenschappelijk onderzoek objectieve criteria zoeken en daaruit doeltreffende nieuwe methoden ontwikkelen om dat “belang van het kind\ zo goed mogelijk te realiseren en in de praktijk de beste beslissing te kunnen nemen. (predictoren voor gezinsplaatsingen en wetsvoorstellen over ouderlijk gezag en verblijfsregelingen bij scheiding, ...).  Hierdoor de latere onaangepastheid (jeugdcriminaliteit, drugsgebruik, psychiatrie, werkloosheid, ...) van die kinderen voorkomen door hen een harmonieuzer gezinsleven te bezorgen. Deze onderzoeksresultaten,  criteria en methodes toepassen in eigen dienstverlening (familiale bemiddeling als hulp om via dialoog solidair de eigen verantwoordelijkheid op te nemen om verdraagzaam en harmonieus verder samen te leven en de kans op armoede te verminderen, ...) en bekend maken aan alle betrokkenen in Europa. Deze ervaring doorgeven aan de volgende generaties. """,NULL,NULL,1,8/1/2012 16:50,
386,,Centrum Ganspoel vzw,,1,Ganspoel,2,3040,Huldenberg,2,,,,gesubsidieerde vzw,Ganspoel is een voorziening voor mensen met een visueel meervoudige beperking. Wij begeleiden en ondersteunen mensen bij alle activiteiten van het dagelijks leven. ,NULL,NULL,1,8/7/2012 10:11,
387,,LINC vzw,,1,Maria-Theresiastraat,20,3000,Leuven,2,,,www.linc-vzw.be,beweging,"LINC werkt enthousiast rond Lezen, INformatie en Communicatie. We zijn een beweging binnen het sociaal-culturele vormingswerk voor volwassenen en ijveren ervoor om zoveel mogelijk mensen bij de kennismaatschappij te betrekken. Dat doen we door projecten op te zetten rond leesbevordering, maar ook door mensen vertrouwd te maken met de digitale wereld.",NULL,NULL,1,8/7/2012 14:47,
388,,Drive for Life,DFL,1,vzw in oprichting,vzw in oprichting,3500,Hasselt,3,,,www.driveforlife.no,,Jongeren helpen hun richting in het leven te vinden via actiesporten in combinatie met een academisch onderbouwd programma.,NULL,NULL,1,8/28/2012 21:57,
389,,Het Nieuwstedelijk,BZB,1,Vaartkom,4,3000,Leuven,2,,,www.nieuwstedelijk.be,muziektheatergezelschap,"Kwaliteitsvol muziektheater brengen voor zoveel mogelijk mensen 

Een gezelschap van makers

Nieuwe teksten, nieuwe muziek

Iets vertellen dat er toe doet

Stadstheater Leuven",NULL,,1,8/30/2012 14:41,
390,,De Open Deur,,1,Pelgrimstraat,27,2000,Antwerpen,1,,,www.deopendeur.be,,"‘De Open Deur’ biedt gratis face-to-face en telefonische gesprekken aan aan mensen die eenzaam zijn, relationele of andere problemen hebben.",NULL,NULL,1,8/31/2012 09:58,
391,,Koraal vzw,,1,Otto Veniusstraat,20,2000,Antwerpen,1,,,http://www.koraal.be,,"-begeleiding van gezinnen met kinderen van 0 tot 12 jaar die tijdelijk hulp nodig hebben bij het opvoeden 

-10 speelpleinwerkingen in en rond Antwerpen, gedragen door gevormde en enthousiaste vrijwlligers",NULL,NULL,1,9/5/2012 10:44,
392,,Van Celst,,1,Waarlooshofstraat,3,20202,Antwerpen,1,,,Www.jeugdzorgemmaus.be,Instelling voor bijzondere jeugdzorg,Huis voor begeleiding van jongeren en hun gezinnen. ,NULL,NULL,1,10/2/2012 15:47,
393,,Mobilant vzw,,1,Dries,2a,2550,Kontich,1,,,www.apor.be of www.debricke.be,,Mobiele en ambulante begeleiding aan zelfstandig wonende personen met een beperking,NULL,NULL,1,10/5/2012 13:05,
394,,stad antwerpen-servicepunt vrijwilligers,,4,carnotstraat,110,2060,Antwerpen,1,,,www.antwerpen/vrijwilligers,,Servicepunt vrijwilligers heeft als opdracht het koppelen van vrijwilligers uit kansengroepen aan vrijwilligerswerk en de gastorganisaties ondersteunen in het werken met vrijwilligers uit kansengroepen. ,NULL,NULL,1,10/16/2012 14:13,
395,,Raad Directeurs CLB-centra GO!,Radi,4,Dieleghemsesteenweg,24-26,1090,Brussel,6,,,,,Belangenbehartiging en beleidsondersteuning van de 24 CLB-centra van het GO!,NULL,NULL,1,10/19/2012 16:31,
396,,Ambassade van het Koningrijk der Nederlanden (Economische- & Handelsafdeling),,4,Kortenberglaan,4-Oct,1040,Brussel,6,,,Belgie.nlambassade.org,,"

Voor een handelsnatie als Nederland zijn goede internationale betrekkingen van levensbelang. Het ministerie van Buitenlandse Zaken behartigt die betrekkingen, zowel vanuit het departement in Den Haag als via een netwerk van ruim 150 vertegenwoordigingen over de hele wereld. Zij vormen de ogen en oren van Nederland in het buitenland.



",NULL,NULL,1,10/30/2012 14:59,
397,,UA-DSSB,Dienst studieadvies en studentenbegeleiding,4,Lange Sint Annastraat,7,2000,Antwerpen,1,,,www.ua.ac.be/studieloopbaanbegeleiding,," Verstevigen draagvlak in de faculteiten op het vlak van:

- studieloopbaanbegeleiding op maat als kwaliteitslabel;

- generieke vaardigheden (studie)loopbaanleren integreren in het curriculum;

- de instroom, doorstroom, studievoortgang, uitstroom en uitval opvolgen op individueel als geaggregeerd niveau.

",NULL,NULL,1,11/8/2012 17:31,
398,,Groep LITP,,1,Ilgatlaan,11,3500,Hasslet,3,,,litp.be,ambulante geestelijke gezondeheidszorg en rehabilitatie,peronen met geestelijke gezondheidsproblemen tot maximale participatie brengen,NULL,NULL,1,11/12/2012 13:35,
399,,Atelier Groot Eiland,,1,Henegouwenkaai,29,1080,Molenbeek,6,,,www.ateliergrooteiland.be,,Kansarmoedebestrijding via arbeid,NULL,NULL,1,12/10/2012 16:22,
400,,Boreas vzw,,1,Rijkendalstraat,12,1853,Grimbergen,2,,,actie-noordrand@belgacom.net,,"De omgeving en de omwonenden van de luchthaven beschermen. Dit omvat de bestrijding van de milieuhinder in het algemeen en van de lawaaihinder in het bijzonder, veroorzaakt door de exploitatie van de Luchthaven Brussel-Nationaal. De gezondheidseffecten hierbij zijn belangrijk.",NULL,NULL,1,1/15/2013 19:44,
402,,A-Switch,,2,Turfkuilen,14,2200,Herentals,1,,,www.aswitch.be,,"A-Switch bvba begeleid organisaties die meer klant-of relatiegericht willen gaan werken. A-Switch bvba begeleid organisaties bij de implementatie van CRM. Dit kan gaan over de doorstart van een \mislukte\"" implementatie of het opstarten van een nieuw project. A-Switch bvba is door de Vlaamse Overheid erkend als adviesverstrekker binnen haar domein.""",NULL,NULL,1,2/26/2013 14:52,
403,,Klasbak,,4,Kardinaal Mercierplein,1,2800,Mechelen,1,,,www.klasbak.net,Netwerkorganisatie,Kwaliteitsvol onderwijs aan gedetineerden in de Vlaamse en Brusselse gevangenissen stimuleren via een netwerk van partners die betrokken zijn in het werkveld en het beleid.,NULL,NULL,1,5/6/2013 12:57,
404,,Arktos,,1,Valkerijgang,26,3000,Leuven,2,,,www.arktos.be,,Vzw Arktos is een vormingsorganisatie voor maatschappelijk kwetsbare kinderen en jongeren.  ,NULL,NULL,1,5/16/2013 14:46,
405,,Wadada,,4,Pijndersstraat,41,9000,Gent,4,,,www.wadada.be,,Dans implementeren in het onderwijs en via de danslessen de ontwikkeling van het Nederlands stimuleren,NULL,NULL,1,5/31/2013 09:22,
406,,KA Etterbeek,KAE,4,Edmond Mesenslaan,2,1040,Etterbeek,6,,,,,ASO,NULL,NULL,1,6/11/2013 10:10,
407,,Federaties Z11 (lees 'zelf),Z11,1,varkensstraat,6,2800,mechelen,1,,,www.vzwz11.be,,"Wij zijn een federatie van 3 sociaal-culturele vormingsorganisaties voor volwassenen met een beperking: Handicum, Het Grote Plein, VIBEG. Wij organiseren vormingen en activiteiten over een brede waaier van thema's: cultuur, expressie, sociale competenties, relaties en seksualiteit, ICT, gezonde voeding, ...",NULL,NULL,1,6/12/2013 15:09,
408,,vzw Astrid,,1,Brugsesteenweg,349 B,9030,Mariakerke,4,,,www.danswijzer.be,,"De dansvereniging \Danswijzer\"" (vzw Astrid) vind je reeds meer dan 30 jaar in Mariakerke bij Gent. Gegroeid door bezieling voor de dans is deze vereniging vandaag een culturele en sociale ontmoetingsplaats waar het gezellig en stijlvol vertoeven is.",,,,,
