idorganization,passwordhash,name,abbreviation,juridicalentity_idjuridicalentity,street,streetnumber,postal,city,province_idprovince,telnr,faxnr,url,organizationtypeother,goal,organizationkeywordother,remark,active,datecreated,email
189,,Stad Vilvoorde,,4,Leuvensestraat,117,1800,Vilvoorde,2,,,,,"Wijkdienst

Doelstelling zoals geformuleerd naar de inwoners van stad Vilvoorde:



Een goede dienstverlening voor de burger, daar werkt het stadsbestuur dagelijks aan. Om die dienstverlening nog dichter bij jou te brengen, werkt het stadsbestuur wijkgericht. Een aantal stadsdiensten, maar ook politie, OCMW en Inter-Vilvoordse komen tot in de wijk. 

Daarom is er in elk van de 7 wijken van Vilvoorde een wijkcentrum ingeplant. De wijkmanager is de aanspreekpersoon in uw wijk.

Klachten, onregelmatigheden, defecten,… kunnen gemeld worden bij de bevoegde stadsdienst, in het wijkcentrum bij de wijkmanager, bij de gemeenschapswachten of via het e-loket.

Elke burger krijgt een wijkkrant in de bus. Hierin vind je alle informatie die van belang is voor jou als wijkbewoner.

De leefbaarheid en veiligheid in de wijken is een grote bekommernis voor het stadsbestuur. Daarom worden er ook specifieke acties georganiseerd in het kader van propere en veilige wijken.

Wijkgericht werken is tenslotte samenwerken. De stad rekent op jouw actieve inzet. Want ook jij, als burger, bent verantwoordelijk voor een propere wijk en veilige wijk. Je kan je stem laten horen en actief meebouwen aan deze stad. Meer informatie vind je bij actieve wijken.

",NULL,,1,2/27/2009 19:29,
190,,SHH,,4,Groeneweg,121,3001,Heverlee,2,,,,,Kennis bijbrengen,NULL,NULL,1,3/11/2009 14:40,
191,,AZ Nikolaas,,1,Moerlandstraat,1,9100,Sint-Niklaas,4,,,www.aznikolaas.be,Algemeen ziekenhuis,"Verlenen van medisch-specialistische gezondheidszorg die toegankelijk, patiëntgericht en kwaliteitsvol is. ",NULL,,1,3/12/2009 16:17,
192,,Cultuurpunt Altena,,4,Gemeenteplein,1,2550,Kontich,1,,,www.kontich.be,,"Bewaren en ontsluiten van het erfgoed, in casu de beschermde neogotische Altenakapel.



De kapel wordt gebruikt voor culturele activiteiten en is ingeschakeld in de werking van een gemeenschapscentrum. Het doel van dit centrum is cultuur brengen naar een zo breed mogelijke doelgroep.",NULL,,1,3/17/2009 09:13,
193,,BZN De Stobbe,,1,J. De Geyterstraat,57,2020,Antwerpen,1,,,www.bzndestobbe.be,,"BZN De Stobbe is een Centrum voor Integrale Gezinszorg dat instaat voor de opvang, begeleiding en behandeling van gezinnen waarbij huiselijk geweld zich voordoet.",NULL,NULL,1,3/18/2009 11:08,
194,,Federatie Palliatieve Zorg Vlaanderen,,1,J. Vander Vekenstraat,158,1780,Wemmel,2,,,www.palliatief.be,Federatie,Federatie die zich in zet voor palliatieve zorgen in Vlaanderen,NULL,NULL,1,3/18/2009 11:20,
195,,MG-Addict,,1,Rue des Cultivateurs,3,1040,Brussel,6,,,www.mg-addict.be,,MG-Addict is een sportvereniging. ,NULL,NULL,0,3/18/2009 11:32,
196,,PC Bethanië,,1,Andreas Vesaliuslaan,39,2980,Zoersel,1,,,www.pcbethanie.be,Psychiatrisch ziekenhuis,"Het Psychiatrisch Ziekenhuis Bethaniënhuis is een zorgvoorziening van de vzw Emmaüs. Het domein van het PC Bethanië is een uitgestrekt geheel van gebouwen - de voorzieningen Psychiatrisch Verzorgingstehuis, Beschut Wonen, en het Psychiatrisch Centrum -, park en groen. Het gaat in totaal om 64 ha grondgebied. Daarnaast is nog een Algemeen Ziekenhuis aanwezig, welke tevens resorteert onder de vzw emmaüs.",NULL,NULL,1,3/18/2009 11:40,
197,,Vlaamse Confederatie van het paard,Vlacopaard,1,Waversebaan,99,3050,Oud-Heverlee,2,,,www.vlacopaard.be,Koepel federatie,Koepelfederatie in het belang van het paard,NULL,,1,3/18/2009 11:54,
198,,Oranjehuis Vzw,,1,Moorseelsestraat,146,8501,Heule,5,,,www.oranjehuis.be,,"Vzw Oranjehuis is actief op het terrein van de integrale jeugdhulpverlening, vorming en opleiding en samenlevingsopbouw. Samen met de lokale bevolking van Heule en Kortrijk hebben wij een open bio-ecologisch boerderijproject op de Heerlijkheid van Heule opgezet. Het project wil werken aan de positieve labeling van probleemjongeren en hun leefomgeving.",NULL,,1,3/18/2009 12:04,
199,,Brusselse Welzijns- en gezondheidsRaad,BWR,1,Leopold II-laan,204,1080,Sint-Jans-Molenbeek,6,,,www.bwr.be,,"De BWR zet zich sinds 1975 in voor een betere bekendmaking van de Nderlandstalige welzijns- en gezondheidszorg in Brussel. Om de dienstverlening van de Brusselse Welzijns- en gezondheidssector te verbeteren, stimuleren en organiseert het overleg en samenwerking binnen de sectoren, worden vormingsactiviteiten georganiseerd en geeft de BWR advies aan beleidsinstanties. De BWR wordt in zijn taak gesubsidieerd en ondersteund door de VGC.",NULL,NULL,1,3/20/2009 14:18,
200,,OSB VUB- Alumni,OSB vzw,1,Triomflaan,40,1160,Oudergem,6,,,www.osb.be,,Door middel van activiteiten de alumni van de Vrije Universiteit Brussel terug met elkaar in contact te brengen.,NULL,NULL,1,3/27/2009 16:38,
201,,Centro Pablo Iglesias,,1,Ropsy-Chaudronstraat,7b,1070,Brussel,6,,,,,"De vereniging heeft als doel de studie, vorming en informatieverspreiding over alle vragen met betrekking tot de geschiedenis van de wereld van de arbeid van de verschillende volkeren en landen van de Europese Unie gaande van de geschiedenis van de migraties tot die van de emancipatiestrijd. In het bijzonder houdt zij zich bezig met de vroegere en huidige banden tussen de Spaanse en België",NULL,NULL,1,4/8/2009 14:29,
202,,Alternatief vzw,,1,Runkstersteenweg,134,3500,Hasselt,3,,,,Opleidings- en tewerkstellingscentrum kansengroepen,"Door middel van verschillende werkvormen opleiding, werkervaring en tewerkstelling aan kansengroepen aanbieden.",NULL,,1,4/8/2009 15:18,
203,,Dwagulu-Dekkente vzw,,1,Kuildam,21,9100,Sint-Niklaas,4,,,www.dwaguludekkente.be,,"Dwagulu-Dekkente vzw is een organisatie ter bevordering van de interculturele solidariteit. 

Ze organiseert inleefreizen en tegenbezoeken voor jongeren uit het vijfde en zesde middelbaar die in Sint-Niklaas school lopen. Deze wederzijdse uitwisselingen gebeuren in samenwerking met Senegalese en Burkinese NGO's en jongerenorganisaties. We richten ons tot jonge mensen en hun omgeving, in noord en zuid. Door vorming proberen we ons meer bewust te worden van de scheve noord-zuid verhoudingen. We willen streven naar een correctere beeldvorming over het Zuiden en het Noorden. We willen ons engageren en mogelijkheden zoeken langs waar verandering mogelijk is, hier bij ons en in het Zuiden. We willen uitwisseling tussen culturen bewerkstellingen in de hoop dat dit de basis vormt voor echte en concrete solidariteit en verzet tegen racisme. Vorming is voor ons zeer belangrijk in de bewustwording van de oorzaken van het onrecht en deze bewustwording is een vereiste voor zinvol engagement. Onze vorming is gebaseerd op 3 pijlers: 

(1) de onderlinge wisselwerking tussen noord en zuid in de wereld, met een focus op duurzame ontwikkeling; 

(2) interculturele uitwisseling en intercultureel leren; 

(3) multiplicatoreffect: ervaring en engagement van de jongeren doen uitstralen naar hun omgeving.",NULL,,1,4/8/2009 16:06,
204,,sportdienst,,4,Markt,18,1750,Lennik,2,,,,,"burgers aanzetten tot levenslang sporten, in kwaliteitsvolle omstandigeheden , elk op zijn eigen niveau",NULL,NULL,1,4/14/2009 13:49,
205,,vzw Timotheus,,1,Jaak De Boeckstraat,73,2170,Merksem,1,,,www.timotheus.be,Gespecialiseerde vormingsinstelling,"De vereniging heeft als doelstelling om vanuit een open, pluriform en multidimensioneel mens- en wereldbeeld, zingeving, persoonlijke groei en maatschappelijk engagement met elkaar te verbinden. Ze geeft daartoe impulsen op tal van domeinen, waaronder: sociale relaties en opvoeding, man en vrouw zijn, sterven en rouwen, niet-confessionele spiritualiteit, gezondheid en ecologie, ethiek en economie.



Als gespecialiseerde vormingsinstelling is de vzw Timotheus actief op het gebied van de niet-formele educatie en legt ze zich toe op intuïtieve ontwikkeling.

",NULL,NULL,1,4/15/2009 13:58,
206,,boek.be - kenniscentrum,,1,Te Boelaerlei,37,2140,Borgerhout,1,,,,,"Boek.be is voortdurend begaan met het culturele en economische klimaat waarin boeken kunnen gedijen. Ze pleit daarvoor bij beleidsmakers en administraties, voert overleg met andere instellingen en organisaties, vergaart kennis en biedt ondersteuning.



Daartoe richtte Boek.be in 2006 het Kenniscentrum op als centraal steunpunt voor het boekenvak.



Het Kenniscentrum kreeg de volgende opdrachten:



* ONDERZOEK EN INNOVATIE

De centrale peiler van het Kenniscentrum. Door kwalitatief en kwantitatief onderzoek reikt Boek.be boekhandels, uitgeverijen en importeurs gegevens aan om hun bedrijfsstrategieën zo nodig bij te stellen. Met Innovatie wordt ingespeeld op de internationale aandacht die er vandaag is voor de creatieve industrieën.

* OPLEIDINGEN

Het doel is om professionele, kwaliteitsvolle, betaalbare en ledengerichte opleidingen en seminaries te organiseren voor het boekenvak.

* STUDIEDAGEN EN SEMINARIES

* ONDERSTEUNIING, INFORMATIE EN STANDPUNTBEPALING

We verzamelen informatie en formuleren standpunten om het maatschappelijke debat te voeden of om de overheden te laten weten welke gevolgen bepaalde wetten of decreten hebben voor het boekenvak. 

* NETWERK EN LOBBYING

Voor het steunpunt van het boekenvak is de uitbouw van een netwerk onontbeerlijk. Dit netwerk deint uit naar alle organisaties en overheden die op de een of andere wijze betrokken partij zijn. ",NULL,,1,4/22/2009 15:49,
207,,Stad Gent - cel Lokaal Sociaal Beleid,Stad Gent - cel LSB,4,Woodrow Wilsonplein,1,9000,Gent,4,,,www.lokaalsociaalbeleidgent.be - www.gent.be,,"Ontwikkelen van nieuwe projecten op vlak van welzijn via samenwerking tussen Stad, OCMW en private welzijnsorganisaties.",NULL,NULL,1,5/6/2009 11:27,
208,,Bru-taal,,1,Ph. de Champagnestraat,23,1000,brussel,6,,,,,Conversatietafels organiseren en andere taalstimulerende intiatieven ondersteunen waardoor anderstalige volwassenen Nederlands kunnen oefenen met een Nederlandstalige vrijwilliger.  Vzw Bru-taal heeft vervult ook een brugfunctie naar Nederlandstalig Brussel en Nederlandstalige Cultuur.,NULL,,1,5/18/2009 12:37,
209,,stad maaseik,,4,lekkerstraat,10,3680,Maaseik,3,,,,Vereniging voor ouderen en  organisatie voor gehandicapten,De doelstelling van de dienst ouderen binnen de stad Maaseik is o.a. de bevordering van de zelfredzaamheid van de oudere inwoners. ,NULL,NULL,1,6/4/2009 11:39,
210,,OLIV,,1,Ertbeekstraat,86,3500,Hasselt,3,,,,,"Vereniging van vrijwilligers uit Limburg, Vlaams-Brabant en Brussel, die door de Minister van Justitie erkend werden als voogden van niet begeleide minderjarige vreemdelingen. 

De vereniging heeft tot doel:

•	de door de Minister van Justitie erkende voogden uit Limburg, Vlaams Brabant en Brussel te steunen bij de uitoefening van hun opdracht en hen te vertegenwoordigen naar externe actoren en bevoegde overheden toe;

•	op structurele wijze de belangen van deze voogden en hun pupillen te behartigen op diverse domeinen, in het bijzonder op gebied van het statuut van de voogd, het verblijf en de terugkeer van de pupil, de huisvesting, het onderwijs, de gezondheid, de ontspanning, de levensovertuiging van de pupil, etc… 

•	het ondersteunen (ook financieel) van de leden bij de begeleiding van hun ex-pupillen na hun 18de levensjaar;

•	de Limburgers, Vlaams-Brabanders en Brusselaars gevoelig maken voor de problematiek van de niet begeleide minderjarige vreemdelingen en kandidaat-voogden te zoeken. 

",NULL,,1,6/5/2009 14:39,
211,,ACW Limburg,,4,Mgr. Broekxplein,6,3500,Hasselt,3,,,www.acwlimburg.be,,"Het ACW is een brede sociale beweging in Vlaanderen met duizenden vrijwilligers is het ACW actief in bijna elke Vlaamse gemeente en in Brussel. 

Het ACW en zijn partnerorganisaties komen op voor een leefbare, solidaire en rechtvaardige samenleving. Samen vertolken ze de zorg van vele gewone mensen. Maar hier blijft het niet bij: ACW zoekt met hen naar oplossingen. ACW geeft stem aan de samenleving.

ACW voert actie.

Maar ACW oefent ook druk uit en beïnvloedt de politiek. ACW zorgt dat er goede oplossingen komen: zorgen voor betaalbare grond, goede huisvestiging, zorgen voor kinderopvang, beter openbaar vervoer, zorgzame samenleving,…

ACW is zelf geen politieke fractie of partij. Ze zijn op de eerste plaats een sociale beweging.",NULL,,1,6/5/2009 14:45,
212,,Brusselse museumraad,,1,Beenhouwerstraat,46,1000,Brussel,6,,,,,"De Brusselse Museumraad (BMR) vormt sedert 1995 een overkoepelende vereniging voor de musea van het Brussels Gewest .

Dit netwerk bestaat uit een zo'n tachtig federale, gemeentelijke, gemeenschaps- en privmusea. Er zijn musea over kunst, technieken, industrie, wetenschappen, folklore, literatuur, geschiedenis en nog vele andere met elk hun eigen stijl. Ze leren ons nieuwe facetten van Brussel kennen en verbazen door de rijkdom van hun collecties en hun kijk op de culturen van de hele wereld.



De doelstellingen van de Brusselse Museumraad zijn :



    * het promoten en vertegenwoordigen van de musea en hun rijke en verscheiden collecties met vaak unieke voorwerpen, als essentile elementen van het culturele leven en de regionale identiteit en van de culturen van al de continenten;

    * het bevorderen van de samenwerking tussen de musea van verschillende disciplines en het stimuleren van hun onderlinge solidariteit en collectieve identiteit;

    * bijdragen tot een verbeterde werking en kwaliteit van de musea en de oplossing van specifieke problemen.

",NULL,NULL,1,6/8/2009 14:03,
213,,KLJ & Groene Kring vzw,KLJ,1,Waversebaan,99,3050,Oud-Heverlee,2,,,www.klj.be,,"KLJ ondersteunt een 300-tal lokale afdelingen op het Vlaamse Platteland. In deze afdelingen komen ongeveer 27 000 kinderen en jongeren van 6 tot 35 jaar op regelmatige basis samen voor toffe en ontspannende activiteiten. Maar dat is niet het doel op zich. Want via deze activiteiten wil KLJ haar steentje bijdragen aan de opbouw van een leefbare maatschappij en dit vanuit christelijke waarden. Zinvol samenzijn en onszelf ontplooien, daar gaan we bij KLJ voor! ",NULL,,1,6/9/2009 09:33,
214,,ART BASICS for CHILDREN,ABC,1,Gaucheretplein,13,1030,Schaarbeek,6,,,www.abc-web.be,kunsteducatieve organisatie,"Kunst en het dagelijks leven dichter bij elkaar brengen, vertrekkende vanuit de persoonlijke ontwikkeling van elk kind.



spelen om te leren en leren om te spelen / via dialoog en associatie naar reflectie / aanzetten tot introspectie / bewuster leren kijken, luisteren en leven / aanmoedigen van burgerschap en democratie 

",NULL,NULL,1,6/10/2009 10:24,
215,,Kenniscentrum Woonzorg Brussel,,1,Sint-Gisleinsstraat,44,1000,Brussel,6,,,,,"Het Kenniscentrum Woonzorg Brussel wil de kwaliteit van de woon- en leefomgeving van oudere Brusselaars verbeteren door allerhande acties te ondernemen. De woonsituatie in Brussel is immers zeer verschillend van deze in Vlaanderen. De meeste mensen in Brussel zijn huurder wat heeft zijn impact op de het onderhoud en de kwaliteit van de woningen. Woonzorg wil voor een aantal specifieke groepen met zorgvragen kwaliteitsvolle, aangepaste en toegankelijke woningen voorzien, zodat langer zelfstandig wonen mogelijk wordt.



",NULL,NULL,1,6/10/2009 15:56,
216,,Belgisch Netwerk Armoedebestrijding,,1,Vooruitgangstraat,333,1030,Schaarbeek,6,,,,,"Het Belgisch Netwerk Armoedebstrijding voert een federaal actieplan uit van staatssecretaris Jean-Marc Delizée. Het federaal actieplan is een werkplan voor 3 jaar (voorbereiding in 2009, uitvoering in 2010 en evaluatie in 2011) in het kader van het Europees jaar in de strijd tegen de armoede (2010) en het Belgisch Presidentschap van de Europese Unie (tweede semester 2010). In 2010 vinden er verschillende federale evenementen en ronde tafels plaats rond verschillende thema’s (dakloosheid, huisvesting, tewerkstelling, sociale standaarden, kinderarmoede, Lissabonakoorden). Daarnaast voert het Belgisch Netwerk Armoedebestrijding ook het Europees project Progress uit, gefinancierd door de Europese Commissie. In het kader hiervan wordt er gewerkt rond het thema sociale zekerheid en sociale inclusie. Tot slot is het Belgisch Netwerk Armoedebestrijding ook betrokken bij de organisatie van het nationaal evenement op 17 oktober, de Europese Ontmoeting van mensen in Armoede, de opvolging van het federaal armoedeplan van de staatssecretaris, samenwerking met het Europees Netwerk,..



 



Het Belgisch Netwerk Armoedebestrijding coördineert in België de acties van de drie regionale netwerken:



 



-          Vlaams netwerk voor Verenigingen waar Armen het Woord nemen (Vlaanderen)



-          Brussels Netwerk (Brussel)



-          Réseau Wallon de Lutte contre la pauvreté (Wallonië)



Deze drie regionale netwerken hebben als leden verschillende verenigingen waar armen het woord nemen. 



De netwerken en verenigingen werken op een participatieve manier en beïnvloeden het beleid samen met mensen in armoede. 



",NULL,,1,6/22/2009 12:39,
217,,Cibo Cleaning,,4,Stapelplein,70,9000,Gent,4,,,,,KMO uit de schoonmaaksector,NULL,,1,6/23/2009 16:26,
218,,Wijkoverleg Vorst en Sint-Gillis,,4,Pastoorstraat,2,1190,Vorst,6,,,,,"Het wijkoverleg Sint-Gillis en Vorst is een overlegplatform van Nederlandstalige culturele en socio-culturele organisaties uit Sint-Gillis en Vorst, getrokken door de gemeentelijke cultuurbeleidscoördinatoren en op de voet gevolgd door de schepenen van Nederlandstalige Aangelegenheden van beide gemeenten en door de Nederlandstalige gemeenteraadsleden. Verder zetelen vertegenwoordigers van de VGC-gemeenschapscentra De Pianofabriek en Ten Weyngaert, de gemeentelijke Nederlandstalige openbare bibliotheken, KAV-Intercultureel, Chiro Brussel, de VGC-Jeugddienst en de Brusselse Welzijns- en Gezondheidsraad.



Het wijkoverleg heeft als voornaamste doelen informatie- en ervaringsuitwisseling, gemeenschappelijke behoeftendetectie en het uitwerken van acties rond gemeenschappelijke thema’s. Veel aandacht gaat naar de problematiek van het ontoereikend Nederlandstalig aanbod voor kinderen en jongeren in de regio.

",NULL,NULL,1,6/24/2009 11:58,
219,,Juliette Roels,,4,ninoofsesteenweg,590,1500,halle,2,,,,,Saving the world xD,NULL,NULL,1,7/2/2009 12:14,
220,,Kazou,,1,Haachtsesteenweg,579 PB 40,1031,Schaarbeek,6,,,www.kazou.be,,"Kazou is een landelijk georganiseerde jeugdwerkorganisatie. Kazou, de jeugddienst van de Christelijke Mutualiteiten, organiseert vakanties voor kinderen en jongeren van 6 tot 18 jaar (vakanties voor kinderen en jongeren met een handicap tot 30 jaar). Jaarlijks gaan 45000 kinderen met ons op vakantie. Dit alles wordt begeleid door vrijwilligers die door kadervorming en andere vormingen worden opgeleid tot goede begeleiders. Het beleid van de organisatie wordt vormgegeven door diezelfde vrijwilligers. ",NULL,NULL,1,7/6/2009 14:17,
221,,gemeenschapscentrum Nekkersdal,,1,E. Bockstaellaan,107,1020,Laken,6,,,,,"Een Nederlandstalig socio-cultureel centrum met een openheid naar anderstaligen en naar de verscheidenheid aan culturen in Brussel. 

Via een cultureel/sport/cursus en welzijns aanbod, tegemoet komen aan de noden van Nederlandstaligen en Nederlandskundigen in Brussel.

",NULL,NULL,1,7/15/2009 18:03,
222,,vzw Ithaka,,1,Kaaistraat,35,8400,Oostende,5,,,www.ithaka.be,,"vzw Ithaka coaht mensen met een verstandelijke beperking. Men probeert zo veel als mogelijk om individuele antwoorden te vinden op hun vragen. Die oplossingen worden op de eerste plaats gezocht in de maatschappij. De coacht helpt de vraag mee verduidelijken, zoeken naar een antwoord, ondersteunend bij de start om daarna stand-by te blijven. Zo is er begeleid werken, deelnemen aan cursussen, opleidingen, hobbbclubs enz. Daarnaast is er binnen de organisatie een winkelverkoop van bioproducten en producten van Oxfam. Medewerkers houden de winkel open en verzorgen de receptie en onthaal van mensen.",NULL,NULL,1,7/29/2009 15:00,
223,,Dienst diversiteit,,4,Oude Baan,207,3630,Maasmechelen,3,,,,,"De Dienst Diversiteit is een gemeentelijke dienst die het samenleven in diversiteit in Maasmechelen wil bevorderen. 

Onze dienst heeft tot doel het integratie -en welzijnsbeleid van de gemeente uit te werken, uit te voeren en op te volgen.

Daarbij richten we ons tot alle inwoners van Maasmechelen met extra aandacht voor bepaalde groepen: personen met een handicap, senioren, allochtonen, woonwagenbewoners,… En dit vanuit verschillende domeinen: allochtoon verenigingsleven, gezondheid, onderwijs, inspraak, communicatie,…

",NULL,NULL,1,7/29/2009 17:01,
224,,magda cultuureducatief netwerk,,4,Professor Van Overstraetenplein,1,3000,Leuven,2,,,www.magdanet.be,,"magda is een cultuureducatief netwerk opgericht om het cultuureducatieve netwerk binnen Leuven en Vlaams-Brabant te versterken door middel van uitwisseling van informatie, afstemming van werkingen , uitbouw van visie en gezamenlijk onderzoek van de sector. ",NULL,NULL,1,9/8/2009 11:16,
225,,Studio,Studio,1,Wijngaardstraat,9,2000,Antwerpen,1,,,www.vzwstudio.be,,Vakvereniging van beroepsfotografen,NULL,NULL,1,9/16/2009 09:30,
226,,School Zonder Racisme,,1,Cellebroersstraat,37,1000,Brussel,6,,,www.schoolzonderracisme.be,,"Jongeren Tegen Racisme - Nationaal (JTR) is dus een vzw die werkt aan vooroordelenbestrijding en antiracistische vorming binnen de jeugd- en onderwijssector. Dit betekent dat JTR ondersteuning geeft in de vorming van jongeren om, ongeacht hun afkomst, goed te functioneren in een maatschappij die gekenmerkt is door een grote ethische, culturele en sociale diversiteit. Het centrale doel van vzw JTR is jongeren op te voeden tot harmonieus samenleven in de huidige multiculturele samenleving vanuit een gezonde houding tegenover de diversiteit die onze samenleving kenmerkt. JTR wil een duidelijk signaal geven voor een open, democratisch en intercultureel onderwijs en jeugdwerk, waarin getracht wordt het racisme terug te dringen. ",NULL,NULL,1,9/22/2009 15:54,
227,,M.P.I. Levenslust,,1,Scheestraat,74,1750,Lennik,2,,,,Door V.A.P.H. gesubsidieerde prive-onderneming,"Opvang, begeleiding van kinderen en jongeren (6 tot 21 jaar) met een beperking door een gedrags of emotionele stoornis en/of door een licht mentale handicap.",NULL,,1,10/1/2009 14:32,
228,,Sfinks Animatie vzw,Sfinks,1,Jan Frans Willemsstraat,10a,2530,Boechout,1,,,www.sfinks.be,,"door een eigenzinnig en avontuurlijk programma (muziek, dans, circus, kinderanimatie) bruggen slagen naar andere culturen",NULL,NULL,1,10/20/2009 15:50,
229,,NV EKO,Kursaal Oostende -,3,Westhelling,geen,8400,Oostende,5,,,www.kursaaloostende.be,NV maar met als aandeelhouder een Autonoom gemeentebedrijf,Theater en businsess events organiseren en zalen verhuren,NULL,NULL,1,10/22/2009 10:54,
230,,ANNE LAUWERS,,4,KAUWENDAAL,12,2800,MECHELEN,1,,,,,"VERBETEREN WEGENNET

BEVOEGDHEID STADSBESTUUR WAT BETREFT AANLEGGEN, AFSLUITEN WEGEN

FILE-PROBLEMATIEK AANPAKKEN

VERPLICHT ONDERLING OVERLEG TUSSEN VERSCHILLENDE STADS-/GEMEENTE-BESTUREN BIJ HET AANLEGGEN/AFSLUITEN STRATEN",NULL,,1,10/28/2009 17:02,
231,,espero,,1,Middelweg,99,1130,Haren,2,,,www.obc-espero.be,,observatie en behandeling (residentieel) voor gezinnen waar kinderen gedrags- of emotionele problemen vertonen,NULL,,1,11/15/2009 23:18,
232,,Beweging voor Kinderen zonder Papieren,BVKZP,1,Kasteelstraat,4,9100,Sint Niklaas,4,,,www.kzp.be,NGO,Verdediging van de rechten van kinderen in precair verblijf,NULL,NULL,1,11/16/2009 15:19,
233,,Vlaamse Vereniging voor Hooggevoelige Personen,HSP Vlaanderen,1,P. Van Duyseplein,12:00 AM,9000,Gent,4,,,www.hspvlaanderen.be,Vrijwilligersorganisatie,"informeren, sensibiliseren, advies verlenen, zelfhulp stimuleren, opvoedingsondersteuning, preventie van stressgerelateerde aandoeningen, preventie van verslavingen, zelfmoordpreventie, reïntegratie van hooggevoelige personen in de maatschappij.",NULL,NULL,1,11/17/2009 20:32,
234,,Stad Gent -  Dienst Feestelijkheden,,4,Gasmeterlaan,107,9000,Gent,4,,,www.gent.be,,"De centrale missie van de Dienst Feestelijkheden is zoveel mogelijk mensen in contact brengen met kwaliteitsvolle evenementen op het openbaar domein. Dat kan door de ondersteuning en/of coördinatie van grote en kleine evenementen, de organisatie van eigen evenementen en de ondersteuning/stimulering van initiatieven door de Gentenaars zelf. Er kan onderscheid gemaakt worden tussen 5 verschillende ondersteuningsvormen: coördinatie/begeleiding, financiële ondersteuning, promotionele ondersteuning, logistieke ondersteuning en informatieve ondersteuning..",NULL,NULL,1,12/3/2009 15:26,
235,,Belgische Confederatie voor Blinden en Slechtzienden,BCBS,1,Georges Henrilaan,278,1200,Brussel,6,,,,,Belangenbehartiging ten behoeve van blinde en slechtziende personen met het doel hun inclusie in de samenleving te bewerkstelligen,NULL,NULL,1,1/19/2010 12:55,
236,,Brigitte Bouzin,,4,Strombeeklinde,100,1853,Strombeek-Bever,2,,,,prive,"Ben moeder van mucoviscidosepatient van 16 jaar. Dagelijks 2 x kine. Kiné oefeningen omvatten werken met een soort blaaspijp met metalen bol ( flutter) die trillingen opwekt zodanig dat de slijmen in de longen loskomen. Om de dagelijkse oefeningen minder eentonig te maken had ik het  gedacht, om via die blaaspijp een computerspel aan te sturen ( eventueel bestaand spel). De motivatie voor mijn zoon, en andere patientjes, zou zijn dat indien hij juist blaast ( ttz een bepaalde frequentie,  die bepaalde trilling veroorzaken in  de blaaspijp) hij het spel kan besturen.  De uitdaging is de trillingen veroorzaakt in de blaaspijp omzetten naar signalen die door de computer kunnen geinterpreteerd, vertaald worden.   ",NULL,NULL,1,1/19/2010 14:40,
237,,Bioforum Vlaanderen,,1,Quellinstraat,42,2018,Antwerpen,1,,,www.bioforum.be,NGO,"BioForum wil dat steeds meer mensen biologische landbouw en voeding kennen, waarderen en consumeren en ambieert de groei van de biologische productie en de verdere ontwikkeling in Vlaanderen van de keten van producent tot consument.",NULL,,1,1/28/2010 14:31,
